{
  "schema_version": "0.1.0",
  "assembly_mode": "deterministic_selection",
  "assembled_at": "2026-03-22T12:54:53Z",
  "source_ref": "/home/lyric/growth-engine-pipeline/content/runs/20260322_125025__x_whitelist_ingest__official_x_original_only/03_source_items/official_x/items/x-openai-8f6ed0f162e6/source_item.json",
  "framework_match_ref": "/home/lyric/growth-engine-pipeline/content/runs/20260322_125025__x_whitelist_ingest__official_x_original_only/06_routing/official_x/results/x-openai-8f6ed0f162e6/framework_match.json",
  "framework_spec_ref": "/home/lyric/growth-engine-pipeline/framework/02_launch_application/FRAMEWORK_SPEC.json",
  "selected_framework": {
    "framework_id": "02_launch_application",
    "framework_label": "发布后落地型",
    "submode_id": "release_showcase",
    "confidence": "high"
  },
  "assembly_manifest": {
    "no_summarization": true,
    "selected_spec_paths": [
      "metadata.framework_id",
      "metadata.framework_label",
      "structure.hidden_skeleton",
      "structure.visible_template_bans",
      "structure.allowed_surface_moves",
      "structure.forbidden_surface_moves",
      "structure.submodes[submode_id=release_showcase]",
      "style.global_style_principles",
      "style.global_anti_ai_rules",
      "style.submode_profiles[style_profile_id=02_release_showcase_style]",
      "execution_controls.must_keep",
      "execution_controls.must_avoid",
      "execution_controls.rewrite_failure_modes",
      "execution_controls.quality_checks",
      "execution_controls.human_review_triggers",
      "samples.sample_refs[sample_id=2033848539332415986]"
    ],
    "selected_sample_ids": [
      "2033848539332415986"
    ],
    "selection_rationale": "Deterministically selected the exact framework slices required by the chosen route: shared structure constraints, the matched submode spec, its mapped style profile, explicitly selected sample refs, and execution controls. No LLM summarization was used."
  },
  "structure_packet": {
    "hidden_skeleton": [
      "Release signal / what's new",
      "Why this matters / old friction or new leverage",
      "What it actually is",
      "How to start / where it fits",
      "Proof through steps, scenarios, or tests",
      "Adoption judgment / CTA"
    ],
    "visible_template_bans": [
      "不得写成统一的先说发布、再说功能、再说怎么用、最后放链接",
      "不得每篇都用完全对称的 1/2/3/4 小标题",
      "不得只罗列 feature，不做采用判断",
      "不得把场景和使用感磨平成官方说明书",
      "不得只会热闹介绍，不会说明适合谁和不适合谁"
    ],
    "allowed_surface_moves": [
      "先从旧方案痛点开局，再引出这次发布",
      "先讲一个真实测试，再回头解释发布内容",
      "先给使用结论，再补适用边界",
      "用步骤、案例、场景、截图说明、价格套餐、配置片段承载骨架",
      "允许 stance 在 instructional / corrective / enthusiastic / craftsmanship 间变化"
    ],
    "forbidden_surface_moves": [
      "把发布信号直接翻成机械模板",
      "每篇都写成标准教程",
      "每篇都写成统一的热闹产品帖",
      "只有夸赞，没有边界或误区",
      "只剩安装说明，没有采用动机"
    ],
    "selected_submode_spec": {
      "submode_id": "release_showcase",
      "label": "资源 / 指南发布展示",
      "summary": "资源、指南、课程、工具或文档发布后，重点不是完整教程，而是快速说明为什么值得收藏、试用或转发。",
      "use_when": [
        "读者首先需要被说服这东西值不值得进收藏夹",
        "文章依赖一句话定位、内容清单、典型场景、实践者背书或入口链接",
        "正文重点是价值展示而不是完整上手说明"
      ],
      "avoid_when": [
        "文章主要要解决具体上手或痛点迁移问题",
        "文章需要详细讲 feature 边界和最佳实践",
        "没有明确发布对象或资源入口"
      ],
      "source_fit": [
        "开源工具、模型、文档、课程、资源库发布",
        "实践者打磨很久后正式公开的资源、指南或合集"
      ],
      "source_unfit": [
        "需要详细教程的采用文",
        "没有资源入口和对象定位的普通感慨",
        "空泛通稿"
      ],
      "hidden_flow": [
        "Release announcement",
        "One-sentence positioning",
        "What's inside",
        "Concrete scenarios or examples",
        "Why this matters / who it helps",
        "Link or entry point"
      ],
      "hook_patterns": [
        "开源了个好东西",
        "今天，终于正式和大家见面了",
        "简单说，它是...",
        "更有意思的是..."
      ],
      "evidence_mix": [
        "一句话定位",
        "内容或能力清单",
        "典型使用场景",
        "制作过程或亲测背书",
        "开源地址或入口链接"
      ],
      "reasoning_moves": [
        "先把门槛降下来，告诉读者这到底是什么",
        "用场景切换让读者迅速想象价值",
        "用制作过程或实践过程证明质量",
        "最后把热情落到具体入口"
      ],
      "rewrite_formula": "发布 -> 白话定位 -> 内容或能力展开 -> 场景证明 -> 价值判断 -> 入口链接",
      "surface_forms": [
        "一句话定位",
        "内容清单",
        "场景举例",
        "制作过程",
        "入口链接"
      ],
      "anti_patterns": [
        "一上来就抽象夸产品",
        "只有 feature list，没有价值想象",
        "只有场景，没有对象定位",
        "写成空泛发布通稿"
      ],
      "style_profile_id": "02_release_showcase_style",
      "sample_ids": [
        "2033848539332415986",
        "2032044423413182827"
      ]
    }
  },
  "style_packet": {
    "global_style_principles": [
      "不在发布消息上停留太久",
      "很快从发生了什么切到你能怎么用",
      "有意识降低理解门槛，常用白话定义和场景说明",
      "结尾通常把读者推向某个采用动作，而不是只留下感叹",
      "必须走 隐式采用逻辑 + 子模式语感层，不能把框架写成统一教程模板"
    ],
    "global_anti_ai_rules": [
      "避免每篇都以下面我将介绍开头",
      "避免统一的发布 -> 功能 -> 用法 -> 总结模板",
      "避免把正文写成官方帮助中心",
      "避免只会夸新，不会说明边界与误区",
      "避免只学热闹，不学采用判断和真实证明",
      "允许 stance 变化，但必须由真实试用、场景或路径托住"
    ],
    "selected_style_profile": {
      "style_profile_id": "02_release_showcase_style",
      "submode_id": "release_showcase",
      "tone_core": "更像热情、可信的资源分享，重点不是完整教程，而是让你快速判断它值不值得进收藏夹。",
      "opening_moves": [
        "开源了个好东西",
        "今天，终于正式和大家见面了",
        "简单说，它是...",
        "先讲我们打磨了很久 / 我体验过"
      ],
      "sentence_rhythm": [
        "句子最短、最轻",
        "常用短段切场景",
        "情绪是热的，但推进不凶",
        "几乎不用复杂理论解释"
      ],
      "surface_forms": [
        "一句话定位",
        "内容清单",
        "场景举例",
        "制作过程",
        "入口链接"
      ],
      "language_moves": [
        "简单说",
        "先说它怎么用",
        "更有意思的是",
        "比如",
        "我们做了很久 / 每一步都亲自实践过"
      ],
      "keep": [
        "低门槛定位",
        "快速场景想象",
        "实践者背书",
        "具体入口"
      ],
      "avoid": [
        "空泛通稿",
        "万能场景编造",
        "只有很强很全很免费",
        "制作过程写成煽情自述"
      ],
      "ai_smells": [
        "只有漂亮形容词，没有对象定位",
        "场景全是万能例子",
        "价值判断和入口脱节",
        "热情超过信息密度"
      ],
      "one_sentence_portrait": "像一个真的用过、打磨过这份资源的人，把值得收藏的理由和入口一起交给你。"
    }
  },
  "sample_packet": {
    "selected_sample_refs": [
      {
        "sample_id": "2033848539332415986",
        "title": "清华团队开源 AI 课堂，人人都能学起来",
        "url": "https://x.com/oran_ge/status/2033848539332415986",
        "author": "@oran_ge",
        "submode_id": "release_showcase",
        "why_it_matters": "中文资源发布型典型样本，用高级版 NotebookLM 这类白话定位快速完成价值翻译。",
        "hook_move": "先说开源了个好东西，再用高级版 NotebookLM 一秒钟定位。",
        "proof_mode": [
          "一句话定位",
          "快速上手说明",
          "多个使用场景",
          "教育意义收束",
          "链接出口"
        ],
        "reusable_parts": [
          "简单说，它是...",
          "先讲怎么用，再给具体场景",
          "把抽象功能翻成学习场景"
        ],
        "non_reusable_parts": [
          "清华团队背书",
          "OpenMAIC 名称和链接"
        ],
        "style_cue": "低门槛定义、快速举例、把抽象功能翻成人人能想象的学习场景。"
      }
    ],
    "sample_selection_rationale": "Used matched_sample_ids from framework_match final_decision."
  },
  "execution_packet": {
    "must_keep": [
      "明确发布触发点",
      "功能 -> 收益 / 动作 的翻译",
      "采用路径或采用判断",
      "真实证明，例如步骤、测试、场景或制作过程",
      "边界、误区或对象定位",
      "相应子模式的表层语感"
    ],
    "must_avoid": [
      "纯发布复述",
      "只有 feature list，没有采用判断",
      "写成厚重官方文档",
      "写成空泛种草通稿",
      "把隐式采用逻辑直接翻成模板"
    ],
    "rewrite_failure_modes": [
      "feature_playbook 退化成新闻稿或 help center",
      "pain_to_adoption 退化成硬广或假痛点",
      "release_showcase 退化成空泛通稿",
      "文章热闹但没有读者第一步动作",
      "文章有步骤但没有说明为什么值得采用",
      "文章只学结构，没有保留 stance"
    ],
    "quality_checks": [
      "是否明确说明了发布对象和这次变化是什么",
      "是否把功能、资源或系统翻译成了收益、场景或动作",
      "是否给了读者开始采用、测试或判断的路径",
      "是否保留了适用边界、误区或对象定位",
      "是否使用了具体证据，而不是只重复宣传语",
      "是否保留了对应子模式的语感，而不是统一教程模板"
    ],
    "human_review_triggers": [
      "source 同时像 02_launch_application 与 06_checklist_template，难区分是发布后采用还是能力交付型分享",
      "文章没有明确发布触发点，但又像采用文",
      "writer 输出后像官方文档改写，没有人味和采用判断",
      "pain_to_adoption 的旧痛点过弱，可能不该走这个子模式",
      "release_showcase 没有入口链接、对象定位或实践背书"
    ]
  },
  "writer_guardrails": {
    "use_raw_source_as_primary_fact_base": true,
    "do_not_summarize_framework_spec": true,
    "preserve_hidden_structure_as_invisible": true,
    "prefer_sample_voice_over_template_surface": true
  },
  "capability_packets": {
    "playbook_version": "2026-03-20.v1",
    "playbook_ref": "content/research/hook_study/2026-03-20/04_second_round/capability_playbook.json",
    "global_anti_patterns": [
      "Background-first opening",
      "Title as neutral explanation",
      "Dek repeating the title",
      "Unclear source identity",
      "Flat mid-section with no attention resets",
      "Bullet lists used in place of reasoning",
      "Process-tail ending",
      "Learning stylistic habits from promo wrappers or link shells"
    ],
    "sample_quality_gate": {
      "positive_sample_requirements": [
        "Has a clear thesis instead of pure forwarding or recommendation",
        "Contains at least one evidence expansion: result, process, mechanism, comparison, scenario, or checklist",
        "Shows pacing or section-level movement instead of one flat explanatory block",
        "Ends with a judgment, action, boundary, risk, or lift"
      ],
      "minimum_positive_requirement_count": 3,
      "exclude_patterns": [
        "Pure endorsement or follow recommendation",
        "Bare x.com/i/article link wrapper with no thesis",
        "Second-hand packaging with no original angle",
        "Pure hype or result bait without mechanism or judgment"
      ]
    },
    "title_attack_packet": {
      "job": "Break the reader's default frame and expose the real stakes before the article starts.",
      "recommended_moves": [
        {
          "move_id": "release_to_adoption",
          "label": "Release to adoption",
          "when_to_use": "The source is a release, launch, or feature update and the article should focus on adoption judgment."
        },
        {
          "move_id": "old_frame_invalidated",